No.     Time           Source                Destination           Protocol Length Info
      1 0.000000000    192.168.188.25        172.217.17.74         TLSv1.2  112    Application Data

Frame 1: 112 bytes on wire (896 bits), 112 bytes captured (896 bits) on interface 0
Ethernet II, Src: IntelCor_19:73:91 (60:57:18:19:73:91), Dst: Avm_1e:34:b5 (bc:05:43:1e:34:b5)
Internet Protocol Version 4, Src: 192.168.188.25 (192.168.188.25), Dst: 172.217.17.74 (172.217.17.74)
Transmission Control Protocol, Src Port: 57220 (57220), Dst Port: 443 (443), Seq: 1, Ack: 1, Len: 46
Secure Sockets Layer

No.     Time           Source                Destination           Protocol Length Info
      2 0.000029000    192.168.188.25        216.58.212.227        TLSv1.2  112    Application Data

Frame 2: 112 bytes on wire (896 bits), 112 bytes captured (896 bits) on interface 0
Ethernet II, Src: IntelCor_19:73:91 (60:57:18:19:73:91), Dst: Avm_1e:34:b5 (bc:05:43:1e:34:b5)
Internet Protocol Version 4, Src: 192.168.188.25 (192.168.188.25), Dst: 216.58.212.227 (216.58.212.227)
Transmission Control Protocol, Src Port: 59100 (59100), Dst Port: 443 (443), Seq: 1, Ack: 1, Len: 46
Secure Sockets Layer

No.     Time           Source                Destination           Protocol Length Info
      3 0.000043000    192.168.188.25        216.58.208.42         TLSv1.2  112    Application Data

Frame 3: 112 bytes on wire (896 bits), 112 bytes captured (896 bits) on interface 0
Ethernet II, Src: IntelCor_19:73:91 (60:57:18:19:73:91), Dst: Avm_1e:34:b5 (bc:05:43:1e:34:b5)
Internet Protocol Version 4, Src: 192.168.188.25 (192.168.188.25), Dst: 216.58.208.42 (216.58.208.42)
Transmission Control Protocol, Src Port: 52134 (52134), Dst Port: 443 (443), Seq: 1, Ack: 1, Len: 46
Secure Sockets Layer

No.     Time           Source                Destination           Protocol Length Info
      4 0.000082000    192.168.188.25        172.217.17.67         TLSv1.2  112    Application Data

Frame 4: 112 bytes on wire (896 bits), 112 bytes captured (896 bits) on interface 0
Ethernet II, Src: IntelCor_19:73:91 (60:57:18:19:73:91), Dst: Avm_1e:34:b5 (bc:05:43:1e:34:b5)
Internet Protocol Version 4, Src: 192.168.188.25 (192.168.188.25), Dst: 172.217.17.67 (172.217.17.67)
Transmission Control Protocol, Src Port: 56342 (56342), Dst Port: 443 (443), Seq: 1, Ack: 1, Len: 46
Secure Sockets Layer

No.     Time           Source                Destination           Protocol Length Info
      5 0.080095000    172.217.17.74         192.168.188.25        TCP      66     443→57220 [ACK] Seq=1 Ack=47 Win=175 Len=0 TSval=3209982372 TSecr=28704470

Frame 5: 66 bytes on wire (528 bits), 66 bytes captured (528 bits) on interface 0
Ethernet II, Src: Avm_1e:34:b5 (bc:05:43:1e:34:b5), Dst: IntelCor_19:73:91 (60:57:18:19:73:91)
Internet Protocol Version 4, Src: 172.217.17.74 (172.217.17.74), Dst: 192.168.188.25 (192.168.188.25)
Transmission Control Protocol, Src Port: 443 (443), Dst Port: 57220 (57220), Seq: 1, Ack: 47, Len: 0

No.     Time           Source                Destination           Protocol Length Info
      6 0.082646000    172.217.17.74         192.168.188.25        TLSv1.2  112    Application Data

Frame 6: 112 bytes on wire (896 bits), 112 bytes captured (896 bits) on interface 0
Ethernet II, Src: Avm_1e:34:b5 (bc:05:43:1e:34:b5), Dst: IntelCor_19:73:91 (60:57:18:19:73:91)
Internet Protocol Version 4, Src: 172.217.17.74 (172.217.17.74), Dst: 192.168.188.25 (192.168.188.25)
Transmission Control Protocol, Src Port: 443 (443), Dst Port: 57220 (57220), Seq: 1, Ack: 47, Len: 46
Secure Sockets Layer

No.     Time           Source                Destination           Protocol Length Info
      7 0.082658000    192.168.188.25        172.217.17.74         TCP      66     57220→443 [ACK] Seq=47 Ack=47 Win=237 Len=0 TSval=28704490 TSecr=3209982372

Frame 7: 66 bytes on wire (528 bits), 66 bytes captured (528 bits) on interface 0
Ethernet II, Src: IntelCor_19:73:91 (60:57:18:19:73:91), Dst: Avm_1e:34:b5 (bc:05:43:1e:34:b5)
Internet Protocol Version 4, Src: 192.168.188.25 (192.168.188.25), Dst: 172.217.17.74 (172.217.17.74)
Transmission Control Protocol, Src Port: 57220 (57220), Dst Port: 443 (443), Seq: 47, Ack: 47, Len: 0

No.     Time           Source                Destination           Protocol Length Info
      8 0.096864000    216.58.208.42         192.168.188.25        TCP      66     443→52134 [ACK] Seq=1 Ack=47 Win=187 Len=0 TSval=3182170285 TSecr=28704470

Frame 8: 66 bytes on wire (528 bits), 66 bytes captured (528 bits) on interface 0
Ethernet II, Src: Avm_1e:34:b5 (bc:05:43:1e:34:b5), Dst: IntelCor_19:73:91 (60:57:18:19:73:91)
Internet Protocol Version 4, Src: 216.58.208.42 (216.58.208.42), Dst: 192.168.188.25 (192.168.188.25)
Transmission Control Protocol, Src Port: 443 (443), Dst Port: 52134 (52134), Seq: 1, Ack: 47, Len: 0

No.     Time           Source                Destination           Protocol Length Info
      9 0.096875000    216.58.208.42         192.168.188.25        TLSv1.2  112    Application Data

Frame 9: 112 bytes on wire (896 bits), 112 bytes captured (896 bits) on interface 0
Ethernet II, Src: Avm_1e:34:b5 (bc:05:43:1e:34:b5), Dst: IntelCor_19:73:91 (60:57:18:19:73:91)
Internet Protocol Version 4, Src: 216.58.208.42 (216.58.208.42), Dst: 192.168.188.25 (192.168.188.25)
Transmission Control Protocol, Src Port: 443 (443), Dst Port: 52134 (52134), Seq: 1, Ack: 47, Len: 46
Secure Sockets Layer

No.     Time           Source                Destination           Protocol Length Info
     10 0.096882000    216.58.212.227        192.168.188.25        TCP      66     443→59100 [ACK] Seq=1 Ack=47 Win=212 Len=0 TSval=1787817415 TSecr=28704470

Frame 10: 66 bytes on wire (528 bits), 66 bytes captured (528 bits) on interface 0
Ethernet II, Src: Avm_1e:34:b5 (bc:05:43:1e:34:b5), Dst: IntelCor_19:73:91 (60:57:18:19:73:91)
Internet Protocol Version 4, Src: 216.58.212.227 (216.58.212.227), Dst: 192.168.188.25 (192.168.188.25)
Transmission Control Protocol, Src Port: 443 (443), Dst Port: 59100 (59100), Seq: 1, Ack: 47, Len: 0

No.     Time           Source                Destination           Protocol Length Info
     11 0.096895000    216.58.212.227        192.168.188.25        TLSv1.2  112    Application Data

Frame 11: 112 bytes on wire (896 bits), 112 bytes captured (896 bits) on interface 0
Ethernet II, Src: Avm_1e:34:b5 (bc:05:43:1e:34:b5), Dst: IntelCor_19:73:91 (60:57:18:19:73:91)
Internet Protocol Version 4, Src: 216.58.212.227 (216.58.212.227), Dst: 192.168.188.25 (192.168.188.25)
Transmission Control Protocol, Src Port: 443 (443), Dst Port: 59100 (59100), Seq: 1, Ack: 47, Len: 46
Secure Sockets Layer

No.     Time           Source                Destination           Protocol Length Info
     12 0.096898000    172.217.17.67         192.168.188.25        TCP      66     443→56342 [ACK] Seq=1 Ack=47 Win=175 Len=0 TSval=61237642 TSecr=28704470

Frame 12: 66 bytes on wire (528 bits), 66 bytes captured (528 bits) on interface 0
Ethernet II, Src: Avm_1e:34:b5 (bc:05:43:1e:34:b5), Dst: IntelCor_19:73:91 (60:57:18:19:73:91)
Internet Protocol Version 4, Src: 172.217.17.67 (172.217.17.67), Dst: 192.168.188.25 (192.168.188.25)
Transmission Control Protocol, Src Port: 443 (443), Dst Port: 56342 (56342), Seq: 1, Ack: 47, Len: 0

No.     Time           Source                Destination           Protocol Length Info
     13 0.096901000    172.217.17.67         192.168.188.25        TLSv1.2  112    Application Data

Frame 13: 112 bytes on wire (896 bits), 112 bytes captured (896 bits) on interface 0
Ethernet II, Src: Avm_1e:34:b5 (bc:05:43:1e:34:b5), Dst: IntelCor_19:73:91 (60:57:18:19:73:91)
Internet Protocol Version 4, Src: 172.217.17.67 (172.217.17.67), Dst: 192.168.188.25 (192.168.188.25)
Transmission Control Protocol, Src Port: 443 (443), Dst Port: 56342 (56342), Seq: 1, Ack: 47, Len: 46
Secure Sockets Layer

No.     Time           Source                Destination           Protocol Length Info
     14 0.096909000    192.168.188.25        172.217.17.67         TCP      66     56342→443 [ACK] Seq=47 Ack=47 Win=237 Len=0 TSval=28704494 TSecr=61237642

Frame 14: 66 bytes on wire (528 bits), 66 bytes captured (528 bits) on interface 0
Ethernet II, Src: IntelCor_19:73:91 (60:57:18:19:73:91), Dst: Avm_1e:34:b5 (bc:05:43:1e:34:b5)
Internet Protocol Version 4, Src: 192.168.188.25 (192.168.188.25), Dst: 172.217.17.67 (172.217.17.67)
Transmission Control Protocol, Src Port: 56342 (56342), Dst Port: 443 (443), Seq: 47, Ack: 47, Len: 0

No.     Time           Source                Destination           Protocol Length Info
     15 0.103843000    192.168.188.25        54.204.11.224         TCP      66     48512→443 [ACK] Seq=1 Ack=1 Win=342 Len=0 TSval=28704496 TSecr=3207260305

Frame 15: 66 bytes on wire (528 bits), 66 bytes captured (528 bits) on interface 0
Ethernet II, Src: IntelCor_19:73:91 (60:57:18:19:73:91), Dst: Avm_1e:34:b5 (bc:05:43:1e:34:b5)
Internet Protocol Version 4, Src: 192.168.188.25 (192.168.188.25), Dst: 54.204.11.224 (54.204.11.224)
Transmission Control Protocol, Src Port: 48512 (48512), Dst Port: 443 (443), Seq: 1, Ack: 1, Len: 0

No.     Time           Source                Destination           Protocol Length Info
     16 0.135835000    192.168.188.25        216.58.212.227        TCP      66     59100→443 [ACK] Seq=47 Ack=47 Win=245 Len=0 TSval=28704504 TSecr=1787817415

Frame 16: 66 bytes on wire (528 bits), 66 bytes captured (528 bits) on interface 0
Ethernet II, Src: IntelCor_19:73:91 (60:57:18:19:73:91), Dst: Avm_1e:34:b5 (bc:05:43:1e:34:b5)
Internet Protocol Version 4, Src: 192.168.188.25 (192.168.188.25), Dst: 216.58.212.227 (216.58.212.227)
Transmission Control Protocol, Src Port: 59100 (59100), Dst Port: 443 (443), Seq: 47, Ack: 47, Len: 0

No.     Time           Source                Destination           Protocol Length Info
     17 0.135849000    192.168.188.25        216.58.208.42         TCP      66     52134→443 [ACK] Seq=47 Ack=47 Win=451 Len=0 TSval=28704504 TSecr=3182170286

Frame 17: 66 bytes on wire (528 bits), 66 bytes captured (528 bits) on interface 0
Ethernet II, Src: IntelCor_19:73:91 (60:57:18:19:73:91), Dst: Avm_1e:34:b5 (bc:05:43:1e:34:b5)
Internet Protocol Version 4, Src: 192.168.188.25 (192.168.188.25), Dst: 216.58.208.42 (216.58.208.42)
Transmission Control Protocol, Src Port: 52134 (52134), Dst Port: 443 (443), Seq: 47, Ack: 47, Len: 0

No.     Time           Source                Destination           Protocol Length Info
     18 0.234085000    54.204.11.224         192.168.188.25        TCP      66     [TCP ACKed unseen segment] 443→48512 [ACK] Seq=1 Ack=2 Win=121 Len=0 TSval=3207262839 TSecr=28696689

Frame 18: 66 bytes on wire (528 bits), 66 bytes captured (528 bits) on interface 0
Ethernet II, Src: Avm_1e:34:b5 (bc:05:43:1e:34:b5), Dst: IntelCor_19:73:91 (60:57:18:19:73:91)
Internet Protocol Version 4, Src: 54.204.11.224 (54.204.11.224), Dst: 192.168.188.25 (192.168.188.25)
Transmission Control Protocol, Src Port: 443 (443), Dst Port: 48512 (48512), Seq: 1, Ack: 2, Len: 0

No.     Time           Source                Destination           Protocol Length Info
     19 1.492650000    192.168.188.25        224.0.0.251           MDNS     87     Standard query 0x0000  PTR _ipps._tcp.local, "QM" question PTR _ipp._tcp.local, "QM" question

Frame 19: 87 bytes on wire (696 bits), 87 bytes captured (696 bits) on interface 0
Ethernet II, Src: IntelCor_19:73:91 (60:57:18:19:73:91), Dst: IPv4mcast_fb (01:00:5e:00:00:fb)
Internet Protocol Version 4, Src: 192.168.188.25 (192.168.188.25), Dst: 224.0.0.251 (224.0.0.251)
User Datagram Protocol, Src Port: 5353 (5353), Dst Port: 5353 (5353)
Domain Name System (query)

No.     Time           Source                Destination           Protocol Length Info
     20 1.767819000    192.168.188.25        95.85.16.212          TCP      66     40144→443 [ACK] Seq=1 Ack=1 Win=250 Len=0 TSval=28704912 TSecr=1834360484

Frame 20: 66 bytes on wire (528 bits), 66 bytes captured (528 bits) on interface 0
Ethernet II, Src: IntelCor_19:73:91 (60:57:18:19:73:91), Dst: Avm_1e:34:b5 (bc:05:43:1e:34:b5)
Internet Protocol Version 4, Src: 192.168.188.25 (192.168.188.25), Dst: 95.85.16.212 (95.85.16.212)
Transmission Control Protocol, Src Port: 40144 (40144), Dst Port: 443 (443), Seq: 1, Ack: 1, Len: 0

No.     Time           Source                Destination           Protocol Length Info
     21 1.812450000    95.85.16.212          192.168.188.25        TCP      66     [TCP ACKed unseen segment] 443→40144 [ACK] Seq=1 Ack=2 Win=243 Len=0 TSval=1834362996 TSecr=28689862

Frame 21: 66 bytes on wire (528 bits), 66 bytes captured (528 bits) on interface 0
Ethernet II, Src: Avm_1e:34:b5 (bc:05:43:1e:34:b5), Dst: IntelCor_19:73:91 (60:57:18:19:73:91)
Internet Protocol Version 4, Src: 95.85.16.212 (95.85.16.212), Dst: 192.168.188.25 (192.168.188.25)
Transmission Control Protocol, Src Port: 443 (443), Dst Port: 40144 (40144), Seq: 1, Ack: 2, Len: 0

No.     Time           Source                Destination           Protocol Length Info
     22 2.000500000    192.168.188.25        104.19.193.102        TLSv1.2  100    Application Data

Frame 22: 100 bytes on wire (800 bits), 100 bytes captured (800 bits) on interface 0
Ethernet II, Src: IntelCor_19:73:91 (60:57:18:19:73:91), Dst: Avm_1e:34:b5 (bc:05:43:1e:34:b5)
Internet Protocol Version 4, Src: 192.168.188.25 (192.168.188.25), Dst: 104.19.193.102 (104.19.193.102)
Transmission Control Protocol, Src Port: 54592 (54592), Dst Port: 443 (443), Seq: 1, Ack: 1, Len: 46
Secure Sockets Layer

No.     Time           Source                Destination           Protocol Length Info
     23 2.020215000    104.19.193.102        192.168.188.25        TCP      54     443→54592 [ACK] Seq=1 Ack=47 Win=31 Len=0

Frame 23: 54 bytes on wire (432 bits), 54 bytes captured (432 bits) on interface 0
Ethernet II, Src: Avm_1e:34:b5 (bc:05:43:1e:34:b5), Dst: IntelCor_19:73:91 (60:57:18:19:73:91)
Internet Protocol Version 4, Src: 104.19.193.102 (104.19.193.102), Dst: 192.168.188.25 (192.168.188.25)
Transmission Control Protocol, Src Port: 443 (443), Dst Port: 54592 (54592), Seq: 1, Ack: 47, Len: 0

No.     Time           Source                Destination           Protocol Length Info
     24 2.020879000    104.19.193.102        192.168.188.25        TLSv1.2  100    Application Data

Frame 24: 100 bytes on wire (800 bits), 100 bytes captured (800 bits) on interface 0
Ethernet II, Src: Avm_1e:34:b5 (bc:05:43:1e:34:b5), Dst: IntelCor_19:73:91 (60:57:18:19:73:91)
Internet Protocol Version 4, Src: 104.19.193.102 (104.19.193.102), Dst: 192.168.188.25 (192.168.188.25)
Transmission Control Protocol, Src Port: 443 (443), Dst Port: 54592 (54592), Seq: 1, Ack: 47, Len: 46
Secure Sockets Layer

No.     Time           Source                Destination           Protocol Length Info
     25 2.059804000    192.168.188.25        104.19.193.102        TCP      54     54592→443 [ACK] Seq=47 Ack=47 Win=237 Len=0

Frame 25: 54 bytes on wire (432 bits), 54 bytes captured (432 bits) on interface 0
Ethernet II, Src: IntelCor_19:73:91 (60:57:18:19:73:91), Dst: Avm_1e:34:b5 (bc:05:43:1e:34:b5)
Internet Protocol Version 4, Src: 192.168.188.25 (192.168.188.25), Dst: 104.19.193.102 (104.19.193.102)
Transmission Control Protocol, Src Port: 54592 (54592), Dst Port: 443 (443), Seq: 47, Ack: 47, Len: 0

No.     Time           Source                Destination           Protocol Length Info
     26 2.255761000    192.168.188.25        192.168.188.255       BROWSER  271    Host Announcement FLEXO, Workstation, Server, Print Queue Server, Xenix Server, NT Workstation, NT Server, Potential Browser, DFS server

Frame 26: 271 bytes on wire (2168 bits), 271 bytes captured (2168 bits) on interface 0
Ethernet II, Src: IntelCor_19:73:91 (60:57:18:19:73:91), Dst: Broadcast (ff:ff:ff:ff:ff:ff)
Internet Protocol Version 4, Src: 192.168.188.25 (192.168.188.25), Dst: 192.168.188.255 (192.168.188.255)
User Datagram Protocol, Src Port: 138 (138), Dst Port: 138 (138)
NetBIOS Datagram Service
SMB (Server Message Block Protocol)
SMB MailSlot Protocol
Microsoft Windows Browser Protocol

No.     Time           Source                Destination           Protocol Length Info
     27 2.823798000    192.168.188.25        95.85.16.212          TCP      66     40148→443 [ACK] Seq=1 Ack=1 Win=365 Len=0 TSval=28705176 TSecr=1834360749

Frame 27: 66 bytes on wire (528 bits), 66 bytes captured (528 bits) on interface 0
Ethernet II, Src: IntelCor_19:73:91 (60:57:18:19:73:91), Dst: Avm_1e:34:b5 (bc:05:43:1e:34:b5)
Internet Protocol Version 4, Src: 192.168.188.25 (192.168.188.25), Dst: 95.85.16.212 (95.85.16.212)
Transmission Control Protocol, Src Port: 40148 (40148), Dst Port: 443 (443), Seq: 1, Ack: 1, Len: 0

No.     Time           Source                Destination           Protocol Length Info
     28 2.823813000    192.168.188.25        95.85.16.212          TCP      66     40150→443 [ACK] Seq=1 Ack=1 Win=364 Len=0 TSval=28705176 TSecr=1834360747

Frame 28: 66 bytes on wire (528 bits), 66 bytes captured (528 bits) on interface 0
Ethernet II, Src: IntelCor_19:73:91 (60:57:18:19:73:91), Dst: Avm_1e:34:b5 (bc:05:43:1e:34:b5)
Internet Protocol Version 4, Src: 192.168.188.25 (192.168.188.25), Dst: 95.85.16.212 (95.85.16.212)
Transmission Control Protocol, Src Port: 40150 (40150), Dst Port: 443 (443), Seq: 1, Ack: 1, Len: 0

No.     Time           Source                Destination           Protocol Length Info
     29 2.855806000    192.168.188.25        95.85.16.212          TCP      66     40152→443 [ACK] Seq=1 Ack=1 Win=365 Len=0 TSval=28705184 TSecr=1834360751

Frame 29: 66 bytes on wire (528 bits), 66 bytes captured (528 bits) on interface 0
Ethernet II, Src: IntelCor_19:73:91 (60:57:18:19:73:91), Dst: Avm_1e:34:b5 (bc:05:43:1e:34:b5)
Internet Protocol Version 4, Src: 192.168.188.25 (192.168.188.25), Dst: 95.85.16.212 (95.85.16.212)
Transmission Control Protocol, Src Port: 40152 (40152), Dst Port: 443 (443), Seq: 1, Ack: 1, Len: 0

No.     Time           Source                Destination           Protocol Length Info
     30 2.855819000    192.168.188.25        95.85.16.212          TCP      66     40154→443 [ACK] Seq=1 Ack=1 Win=364 Len=0 TSval=28705184 TSecr=1834360754

Frame 30: 66 bytes on wire (528 bits), 66 bytes captured (528 bits) on interface 0
Ethernet II, Src: IntelCor_19:73:91 (60:57:18:19:73:91), Dst: Avm_1e:34:b5 (bc:05:43:1e:34:b5)
Internet Protocol Version 4, Src: 192.168.188.25 (192.168.188.25), Dst: 95.85.16.212 (95.85.16.212)
Transmission Control Protocol, Src Port: 40154 (40154), Dst Port: 443 (443), Seq: 1, Ack: 1, Len: 0

No.     Time           Source                Destination           Protocol Length Info
     31 2.864362000    95.85.16.212          192.168.188.25        TCP      66     [TCP ACKed unseen segment] 443→40148 [ACK] Seq=1 Ack=2 Win=243 Len=0 TSval=1834363260 TSecr=28690105

Frame 31: 66 bytes on wire (528 bits), 66 bytes captured (528 bits) on interface 0
Ethernet II, Src: Avm_1e:34:b5 (bc:05:43:1e:34:b5), Dst: IntelCor_19:73:91 (60:57:18:19:73:91)
Internet Protocol Version 4, Src: 95.85.16.212 (95.85.16.212), Dst: 192.168.188.25 (192.168.188.25)
Transmission Control Protocol, Src Port: 443 (443), Dst Port: 40148 (40148), Seq: 1, Ack: 2, Len: 0

No.     Time           Source                Destination           Protocol Length Info
     32 2.864644000    95.85.16.212          192.168.188.25        TCP      66     [TCP ACKed unseen segment] 443→40150 [ACK] Seq=1 Ack=2 Win=243 Len=0 TSval=1834363261 TSecr=28690109

Frame 32: 66 bytes on wire (528 bits), 66 bytes captured (528 bits) on interface 0
Ethernet II, Src: Avm_1e:34:b5 (bc:05:43:1e:34:b5), Dst: IntelCor_19:73:91 (60:57:18:19:73:91)
Internet Protocol Version 4, Src: 95.85.16.212 (95.85.16.212), Dst: 192.168.188.25 (192.168.188.25)
Transmission Control Protocol, Src Port: 443 (443), Dst Port: 40150 (40150), Seq: 1, Ack: 2, Len: 0

No.     Time           Source                Destination           Protocol Length Info
     33 2.896183000    95.85.16.212          192.168.188.25        TCP      66     [TCP ACKed unseen segment] 443→40152 [ACK] Seq=1 Ack=2 Win=243 Len=0 TSval=1834363267 TSecr=28690117

Frame 33: 66 bytes on wire (528 bits), 66 bytes captured (528 bits) on interface 0
Ethernet II, Src: Avm_1e:34:b5 (bc:05:43:1e:34:b5), Dst: IntelCor_19:73:91 (60:57:18:19:73:91)
Internet Protocol Version 4, Src: 95.85.16.212 (95.85.16.212), Dst: 192.168.188.25 (192.168.188.25)
Transmission Control Protocol, Src Port: 443 (443), Dst Port: 40152 (40152), Seq: 1, Ack: 2, Len: 0

No.     Time           Source                Destination           Protocol Length Info
     34 2.896521000    95.85.16.212          192.168.188.25        TCP      66     [TCP ACKed unseen segment] 443→40154 [ACK] Seq=1 Ack=2 Win=243 Len=0 TSval=1834363269 TSecr=28690124

Frame 34: 66 bytes on wire (528 bits), 66 bytes captured (528 bits) on interface 0
Ethernet II, Src: Avm_1e:34:b5 (bc:05:43:1e:34:b5), Dst: IntelCor_19:73:91 (60:57:18:19:73:91)
Internet Protocol Version 4, Src: 95.85.16.212 (95.85.16.212), Dst: 192.168.188.25 (192.168.188.25)
Transmission Control Protocol, Src Port: 443 (443), Dst Port: 40154 (40154), Seq: 1, Ack: 2, Len: 0

No.     Time           Source                Destination           Protocol Length Info
     35 2.983803000    192.168.188.25        95.85.16.212          TCP      66     40160→443 [ACK] Seq=1 Ack=1 Win=365 Len=0 TSval=28705216 TSecr=1834360789

Frame 35: 66 bytes on wire (528 bits), 66 bytes captured (528 bits) on interface 0
Ethernet II, Src: IntelCor_19:73:91 (60:57:18:19:73:91), Dst: Avm_1e:34:b5 (bc:05:43:1e:34:b5)
Internet Protocol Version 4, Src: 192.168.188.25 (192.168.188.25), Dst: 95.85.16.212 (95.85.16.212)
Transmission Control Protocol, Src Port: 40160 (40160), Dst Port: 443 (443), Seq: 1, Ack: 1, Len: 0

No.     Time           Source                Destination           Protocol Length Info
     36 2.983819000    192.168.188.25        95.85.16.212          TCP      66     40158→443 [ACK] Seq=1 Ack=1 Win=365 Len=0 TSval=28705216 TSecr=1834360787

Frame 36: 66 bytes on wire (528 bits), 66 bytes captured (528 bits) on interface 0
Ethernet II, Src: IntelCor_19:73:91 (60:57:18:19:73:91), Dst: Avm_1e:34:b5 (bc:05:43:1e:34:b5)
Internet Protocol Version 4, Src: 192.168.188.25 (192.168.188.25), Dst: 95.85.16.212 (95.85.16.212)
Transmission Control Protocol, Src Port: 40158 (40158), Dst Port: 443 (443), Seq: 1, Ack: 1, Len: 0

No.     Time           Source                Destination           Protocol Length Info
     37 3.011907000    95.85.16.212          192.168.188.25        TCP      66     [TCP ACKed unseen segment] 443→40160 [ACK] Seq=1 Ack=2 Win=243 Len=0 TSval=1834363298 TSecr=28690159

Frame 37: 66 bytes on wire (528 bits), 66 bytes captured (528 bits) on interface 0
Ethernet II, Src: Avm_1e:34:b5 (bc:05:43:1e:34:b5), Dst: IntelCor_19:73:91 (60:57:18:19:73:91)
Internet Protocol Version 4, Src: 95.85.16.212 (95.85.16.212), Dst: 192.168.188.25 (192.168.188.25)
Transmission Control Protocol, Src Port: 443 (443), Dst Port: 40160 (40160), Seq: 1, Ack: 2, Len: 0

No.     Time           Source                Destination           Protocol Length Info
     38 3.015815000    192.168.188.25        95.85.16.212          TCP      66     40162→443 [ACK] Seq=1 Ack=1 Win=365 Len=0 TSval=28705224 TSecr=1834360789

Frame 38: 66 bytes on wire (528 bits), 66 bytes captured (528 bits) on interface 0
Ethernet II, Src: IntelCor_19:73:91 (60:57:18:19:73:91), Dst: Avm_1e:34:b5 (bc:05:43:1e:34:b5)
Internet Protocol Version 4, Src: 192.168.188.25 (192.168.188.25), Dst: 95.85.16.212 (95.85.16.212)
Transmission Control Protocol, Src Port: 40162 (40162), Dst Port: 443 (443), Seq: 1, Ack: 1, Len: 0

No.     Time           Source                Destination           Protocol Length Info
     39 3.015825000    192.168.188.25        95.85.16.212          TCP      66     40156→443 [ACK] Seq=1 Ack=1 Win=365 Len=0 TSval=28705224 TSecr=1834360789

Frame 39: 66 bytes on wire (528 bits), 66 bytes captured (528 bits) on interface 0
Ethernet II, Src: IntelCor_19:73:91 (60:57:18:19:73:91), Dst: Avm_1e:34:b5 (bc:05:43:1e:34:b5)
Internet Protocol Version 4, Src: 192.168.188.25 (192.168.188.25), Dst: 95.85.16.212 (95.85.16.212)
Transmission Control Protocol, Src Port: 40156 (40156), Dst Port: 443 (443), Seq: 1, Ack: 1, Len: 0

No.     Time           Source                Destination           Protocol Length Info
     40 3.015828000    192.168.188.25        95.85.16.212          TCP      66     40166→443 [ACK] Seq=1 Ack=1 Win=365 Len=0 TSval=28705224 TSecr=1834360795

Frame 40: 66 bytes on wire (528 bits), 66 bytes captured (528 bits) on interface 0
Ethernet II, Src: IntelCor_19:73:91 (60:57:18:19:73:91), Dst: Avm_1e:34:b5 (bc:05:43:1e:34:b5)
Internet Protocol Version 4, Src: 192.168.188.25 (192.168.188.25), Dst: 95.85.16.212 (95.85.16.212)
Transmission Control Protocol, Src Port: 40166 (40166), Dst Port: 443 (443), Seq: 1, Ack: 1, Len: 0

No.     Time           Source                Destination           Protocol Length Info
     41 3.024381000    95.85.16.212          192.168.188.25        TCP      66     [TCP ACKed unseen segment] 443→40158 [ACK] Seq=1 Ack=2 Win=243 Len=0 TSval=1834363300 TSecr=28690144

Frame 41: 66 bytes on wire (528 bits), 66 bytes captured (528 bits) on interface 0
Ethernet II, Src: Avm_1e:34:b5 (bc:05:43:1e:34:b5), Dst: IntelCor_19:73:91 (60:57:18:19:73:91)
Internet Protocol Version 4, Src: 95.85.16.212 (95.85.16.212), Dst: 192.168.188.25 (192.168.188.25)
Transmission Control Protocol, Src Port: 443 (443), Dst Port: 40158 (40158), Seq: 1, Ack: 2, Len: 0

No.     Time           Source                Destination           Protocol Length Info
     42 3.046403000    95.85.16.212          192.168.188.25        TCP      66     [TCP ACKed unseen segment] 443→40162 [ACK] Seq=1 Ack=2 Win=243 Len=0 TSval=1834363307 TSecr=28690155

Frame 42: 66 bytes on wire (528 bits), 66 bytes captured (528 bits) on interface 0
Ethernet II, Src: Avm_1e:34:b5 (bc:05:43:1e:34:b5), Dst: IntelCor_19:73:91 (60:57:18:19:73:91)
Internet Protocol Version 4, Src: 95.85.16.212 (95.85.16.212), Dst: 192.168.188.25 (192.168.188.25)
Transmission Control Protocol, Src Port: 443 (443), Dst Port: 40162 (40162), Seq: 1, Ack: 2, Len: 0

No.     Time           Source                Destination           Protocol Length Info
     43 3.047792000    192.168.188.25        95.85.16.212          TCP      66     40164→443 [ACK] Seq=1 Ack=1 Win=365 Len=0 TSval=28705232 TSecr=1834360804

Frame 43: 66 bytes on wire (528 bits), 66 bytes captured (528 bits) on interface 0
Ethernet II, Src: IntelCor_19:73:91 (60:57:18:19:73:91), Dst: Avm_1e:34:b5 (bc:05:43:1e:34:b5)
Internet Protocol Version 4, Src: 192.168.188.25 (192.168.188.25), Dst: 95.85.16.212 (95.85.16.212)
Transmission Control Protocol, Src Port: 40164 (40164), Dst Port: 443 (443), Seq: 1, Ack: 1, Len: 0

No.     Time           Source                Destination           Protocol Length Info
     44 3.057204000    95.85.16.212          192.168.188.25        TCP      66     [TCP ACKed unseen segment] 443→40166 [ACK] Seq=1 Ack=2 Win=243 Len=0 TSval=1834363308 TSecr=28690162

Frame 44: 66 bytes on wire (528 bits), 66 bytes captured (528 bits) on interface 0
Ethernet II, Src: Avm_1e:34:b5 (bc:05:43:1e:34:b5), Dst: IntelCor_19:73:91 (60:57:18:19:73:91)
Internet Protocol Version 4, Src: 95.85.16.212 (95.85.16.212), Dst: 192.168.188.25 (192.168.188.25)
Transmission Control Protocol, Src Port: 443 (443), Dst Port: 40166 (40166), Seq: 1, Ack: 2, Len: 0

No.     Time           Source                Destination           Protocol Length Info
     45 3.057523000    95.85.16.212          192.168.188.25        TCP      66     [TCP ACKed unseen segment] 443→40156 [ACK] Seq=1 Ack=2 Win=243 Len=0 TSval=1834363308 TSecr=28690132

Frame 45: 66 bytes on wire (528 bits), 66 bytes captured (528 bits) on interface 0
Ethernet II, Src: Avm_1e:34:b5 (bc:05:43:1e:34:b5), Dst: IntelCor_19:73:91 (60:57:18:19:73:91)
Internet Protocol Version 4, Src: 95.85.16.212 (95.85.16.212), Dst: 192.168.188.25 (192.168.188.25)
Transmission Control Protocol, Src Port: 443 (443), Dst Port: 40156 (40156), Seq: 1, Ack: 2, Len: 0

No.     Time           Source                Destination           Protocol Length Info
     46 3.079824000    192.168.188.25        95.85.16.212          TCP      66     40168→443 [ACK] Seq=1 Ack=1 Win=365 Len=0 TSval=28705240 TSecr=1834360810

Frame 46: 66 bytes on wire (528 bits), 66 bytes captured (528 bits) on interface 0
Ethernet II, Src: IntelCor_19:73:91 (60:57:18:19:73:91), Dst: Avm_1e:34:b5 (bc:05:43:1e:34:b5)
Internet Protocol Version 4, Src: 192.168.188.25 (192.168.188.25), Dst: 95.85.16.212 (95.85.16.212)
Transmission Control Protocol, Src Port: 40168 (40168), Dst Port: 443 (443), Seq: 1, Ack: 1, Len: 0

No.     Time           Source                Destination           Protocol Length Info
     47 3.085121000    95.85.16.212          192.168.188.25        TCP      66     [TCP ACKed unseen segment] 443→40164 [ACK] Seq=1 Ack=2 Win=243 Len=0 TSval=1834363315 TSecr=28690171

Frame 47: 66 bytes on wire (528 bits), 66 bytes captured (528 bits) on interface 0
Ethernet II, Src: Avm_1e:34:b5 (bc:05:43:1e:34:b5), Dst: IntelCor_19:73:91 (60:57:18:19:73:91)
Internet Protocol Version 4, Src: 95.85.16.212 (95.85.16.212), Dst: 192.168.188.25 (192.168.188.25)
Transmission Control Protocol, Src Port: 443 (443), Dst Port: 40164 (40164), Seq: 1, Ack: 2, Len: 0

No.     Time           Source                Destination           Protocol Length Info
     48 3.111890000    192.168.188.25        95.85.16.212          TCP      66     40172→443 [ACK] Seq=1 Ack=1 Win=365 Len=0 TSval=28705248 TSecr=1834360818

Frame 48: 66 bytes on wire (528 bits), 66 bytes captured (528 bits) on interface 0
Ethernet II, Src: IntelCor_19:73:91 (60:57:18:19:73:91), Dst: Avm_1e:34:b5 (bc:05:43:1e:34:b5)
Internet Protocol Version 4, Src: 192.168.188.25 (192.168.188.25), Dst: 95.85.16.212 (95.85.16.212)
Transmission Control Protocol, Src Port: 40172 (40172), Dst Port: 443 (443), Seq: 1, Ack: 1, Len: 0

No.     Time           Source                Destination           Protocol Length Info
     49 3.115609000    95.85.16.212          192.168.188.25        TCP      66     [TCP ACKed unseen segment] 443→40168 [ACK] Seq=1 Ack=2 Win=243 Len=0 TSval=1834363322 TSecr=28690177

Frame 49: 66 bytes on wire (528 bits), 66 bytes captured (528 bits) on interface 0
Ethernet II, Src: Avm_1e:34:b5 (bc:05:43:1e:34:b5), Dst: IntelCor_19:73:91 (60:57:18:19:73:91)
Internet Protocol Version 4, Src: 95.85.16.212 (95.85.16.212), Dst: 192.168.188.25 (192.168.188.25)
Transmission Control Protocol, Src Port: 443 (443), Dst Port: 40168 (40168), Seq: 1, Ack: 2, Len: 0

No.     Time           Source                Destination           Protocol Length Info
     50 3.150001000    95.85.16.212          192.168.188.25        TCP      66     [TCP ACKed unseen segment] 443→40172 [ACK] Seq=1 Ack=2 Win=243 Len=0 TSval=1834363330 TSecr=28690188

Frame 50: 66 bytes on wire (528 bits), 66 bytes captured (528 bits) on interface 0
Ethernet II, Src: Avm_1e:34:b5 (bc:05:43:1e:34:b5), Dst: IntelCor_19:73:91 (60:57:18:19:73:91)
Internet Protocol Version 4, Src: 95.85.16.212 (95.85.16.212), Dst: 192.168.188.25 (192.168.188.25)
Transmission Control Protocol, Src Port: 443 (443), Dst Port: 40172 (40172), Seq: 1, Ack: 2, Len: 0

No.     Time           Source                Destination           Protocol Length Info
     51 4.679799000    192.168.188.25        88.134.182.112        TCP      66     42422→80 [ACK] Seq=1 Ack=1 Win=237 Len=0 TSval=28705640 TSecr=1896836788

Frame 51: 66 bytes on wire (528 bits), 66 bytes captured (528 bits) on interface 0
Ethernet II, Src: IntelCor_19:73:91 (60:57:18:19:73:91), Dst: Avm_1e:34:b5 (bc:05:43:1e:34:b5)
Internet Protocol Version 4, Src: 192.168.188.25 (192.168.188.25), Dst: 88.134.182.112 (88.134.182.112)
Transmission Control Protocol, Src Port: 42422 (42422), Dst Port: 80 (80), Seq: 1, Ack: 1, Len: 0

No.     Time           Source                Destination           Protocol Length Info
     52 4.698207000    88.134.182.112        192.168.188.25        TCP      66     [TCP ACKed unseen segment] 80→42422 [ACK] Seq=1 Ack=2 Win=939 Len=0 TSval=1896846829 TSecr=28690583

Frame 52: 66 bytes on wire (528 bits), 66 bytes captured (528 bits) on interface 0
Ethernet II, Src: Avm_1e:34:b5 (bc:05:43:1e:34:b5), Dst: IntelCor_19:73:91 (60:57:18:19:73:91)
Internet Protocol Version 4, Src: 88.134.182.112 (88.134.182.112), Dst: 192.168.188.25 (192.168.188.25)
Transmission Control Protocol, Src Port: 80 (80), Dst Port: 42422 (42422), Seq: 1, Ack: 2, Len: 0

No.     Time           Source                Destination           Protocol Length Info
     53 6.583097000    95.85.16.212          192.168.188.25        TLSv1.2  97     [TCP ACKed unseen segment] Encrypted Alert

Frame 53: 97 bytes on wire (776 bits), 97 bytes captured (776 bits) on interface 0
Ethernet II, Src: Avm_1e:34:b5 (bc:05:43:1e:34:b5), Dst: IntelCor_19:73:91 (60:57:18:19:73:91)
Internet Protocol Version 4, Src: 95.85.16.212 (95.85.16.212), Dst: 192.168.188.25 (192.168.188.25)
Transmission Control Protocol, Src Port: 443 (443), Dst Port: 40144 (40144), Seq: 1, Ack: 2, Len: 31
Secure Sockets Layer

No.     Time           Source                Destination           Protocol Length Info
     54 6.583116000    192.168.188.25        95.85.16.212          TCP      66     [TCP Previous segment not captured] 40144→443 [ACK] Seq=2 Ack=32 Win=250 Len=0 TSval=28706115 TSecr=1834364182

Frame 54: 66 bytes on wire (528 bits), 66 bytes captured (528 bits) on interface 0
Ethernet II, Src: IntelCor_19:73:91 (60:57:18:19:73:91), Dst: Avm_1e:34:b5 (bc:05:43:1e:34:b5)
Internet Protocol Version 4, Src: 192.168.188.25 (192.168.188.25), Dst: 95.85.16.212 (95.85.16.212)
Transmission Control Protocol, Src Port: 40144 (40144), Dst Port: 443 (443), Seq: 2, Ack: 32, Len: 0

No.     Time           Source                Destination           Protocol Length Info
     55 6.583125000    95.85.16.212          192.168.188.25        TCP      66     [TCP ACKed unseen segment] 443→40144 [FIN, ACK] Seq=32 Ack=2 Win=243 Len=0 TSval=1834364182 TSecr=28689862

Frame 55: 66 bytes on wire (528 bits), 66 bytes captured (528 bits) on interface 0
Ethernet II, Src: Avm_1e:34:b5 (bc:05:43:1e:34:b5), Dst: IntelCor_19:73:91 (60:57:18:19:73:91)
Internet Protocol Version 4, Src: 95.85.16.212 (95.85.16.212), Dst: 192.168.188.25 (192.168.188.25)
Transmission Control Protocol, Src Port: 443 (443), Dst Port: 40144 (40144), Seq: 32, Ack: 2, Len: 0

No.     Time           Source                Destination           Protocol Length Info
     56 6.583228000    192.168.188.25        95.85.16.212          TCP      66     40144→443 [FIN, ACK] Seq=2 Ack=33 Win=250 Len=0 TSval=28706115 TSecr=1834364182

Frame 56: 66 bytes on wire (528 bits), 66 bytes captured (528 bits) on interface 0
Ethernet II, Src: IntelCor_19:73:91 (60:57:18:19:73:91), Dst: Avm_1e:34:b5 (bc:05:43:1e:34:b5)
Internet Protocol Version 4, Src: 192.168.188.25 (192.168.188.25), Dst: 95.85.16.212 (95.85.16.212)
Transmission Control Protocol, Src Port: 40144 (40144), Dst Port: 443 (443), Seq: 2, Ack: 33, Len: 0

No.     Time           Source                Destination           Protocol Length Info
     57 6.616590000    95.85.16.212          192.168.188.25        TCP      66     443→40144 [ACK] Seq=33 Ack=3 Win=243 Len=0 TSval=1834364199 TSecr=28706115

Frame 57: 66 bytes on wire (528 bits), 66 bytes captured (528 bits) on interface 0
Ethernet II, Src: Avm_1e:34:b5 (bc:05:43:1e:34:b5), Dst: IntelCor_19:73:91 (60:57:18:19:73:91)
Internet Protocol Version 4, Src: 95.85.16.212 (95.85.16.212), Dst: 192.168.188.25 (192.168.188.25)
Transmission Control Protocol, Src Port: 443 (443), Dst Port: 40144 (40144), Seq: 33, Ack: 3, Len: 0

No.     Time           Source                Destination           Protocol Length Info
     58 7.608066000    95.85.16.212          192.168.188.25        TLSv1.2  97     [TCP ACKed unseen segment] Encrypted Alert

Frame 58: 97 bytes on wire (776 bits), 97 bytes captured (776 bits) on interface 0
Ethernet II, Src: Avm_1e:34:b5 (bc:05:43:1e:34:b5), Dst: IntelCor_19:73:91 (60:57:18:19:73:91)
Internet Protocol Version 4, Src: 95.85.16.212 (95.85.16.212), Dst: 192.168.188.25 (192.168.188.25)
Transmission Control Protocol, Src Port: 443 (443), Dst Port: 40148 (40148), Seq: 1, Ack: 2, Len: 31
Secure Sockets Layer

No.     Time           Source                Destination           Protocol Length Info
     59 7.608082000    95.85.16.212          192.168.188.25        TCP      66     [TCP ACKed unseen segment] 443→40148 [FIN, ACK] Seq=32 Ack=2 Win=243 Len=0 TSval=1834364424 TSecr=28690105

Frame 59: 66 bytes on wire (528 bits), 66 bytes captured (528 bits) on interface 0
Ethernet II, Src: Avm_1e:34:b5 (bc:05:43:1e:34:b5), Dst: IntelCor_19:73:91 (60:57:18:19:73:91)
Internet Protocol Version 4, Src: 95.85.16.212 (95.85.16.212), Dst: 192.168.188.25 (192.168.188.25)
Transmission Control Protocol, Src Port: 443 (443), Dst Port: 40148 (40148), Seq: 32, Ack: 2, Len: 0

No.     Time           Source                Destination           Protocol Length Info
     60 7.608194000    192.168.188.25        95.85.16.212          TCP      66     [TCP Previous segment not captured] 40148→443 [FIN, ACK] Seq=2 Ack=33 Win=365 Len=0 TSval=28706372 TSecr=1834364424

Frame 60: 66 bytes on wire (528 bits), 66 bytes captured (528 bits) on interface 0
Ethernet II, Src: IntelCor_19:73:91 (60:57:18:19:73:91), Dst: Avm_1e:34:b5 (bc:05:43:1e:34:b5)
Internet Protocol Version 4, Src: 192.168.188.25 (192.168.188.25), Dst: 95.85.16.212 (95.85.16.212)
Transmission Control Protocol, Src Port: 40148 (40148), Dst Port: 443 (443), Seq: 2, Ack: 33, Len: 0

No.     Time           Source                Destination           Protocol Length Info
     61 7.608255000    95.85.16.212          192.168.188.25        TLSv1.2  97     [TCP ACKed unseen segment] Encrypted Alert

Frame 61: 97 bytes on wire (776 bits), 97 bytes captured (776 bits) on interface 0
Ethernet II, Src: Avm_1e:34:b5 (bc:05:43:1e:34:b5), Dst: IntelCor_19:73:91 (60:57:18:19:73:91)
Internet Protocol Version 4, Src: 95.85.16.212 (95.85.16.212), Dst: 192.168.188.25 (192.168.188.25)
Transmission Control Protocol, Src Port: 443 (443), Dst Port: 40150 (40150), Seq: 1, Ack: 2, Len: 31
Secure Sockets Layer

No.     Time           Source                Destination           Protocol Length Info
     62 7.608351000    192.168.188.25        95.85.16.212          TCP      66     [TCP Previous segment not captured] 40150→443 [FIN, ACK] Seq=2 Ack=32 Win=364 Len=0 TSval=28706372 TSecr=1834364434

Frame 62: 66 bytes on wire (528 bits), 66 bytes captured (528 bits) on interface 0
Ethernet II, Src: IntelCor_19:73:91 (60:57:18:19:73:91), Dst: Avm_1e:34:b5 (bc:05:43:1e:34:b5)
Internet Protocol Version 4, Src: 192.168.188.25 (192.168.188.25), Dst: 95.85.16.212 (95.85.16.212)
Transmission Control Protocol, Src Port: 40150 (40150), Dst Port: 443 (443), Seq: 2, Ack: 32, Len: 0

No.     Time           Source                Destination           Protocol Length Info
     63 7.608574000    95.85.16.212          192.168.188.25        TCP      66     [TCP ACKed unseen segment] 443→40150 [FIN, ACK] Seq=32 Ack=2 Win=243 Len=0 TSval=1834364434 TSecr=28690109

Frame 63: 66 bytes on wire (528 bits), 66 bytes captured (528 bits) on interface 0
Ethernet II, Src: Avm_1e:34:b5 (bc:05:43:1e:34:b5), Dst: IntelCor_19:73:91 (60:57:18:19:73:91)
Internet Protocol Version 4, Src: 95.85.16.212 (95.85.16.212), Dst: 192.168.188.25 (192.168.188.25)
Transmission Control Protocol, Src Port: 443 (443), Dst Port: 40150 (40150), Seq: 32, Ack: 2, Len: 0

No.     Time           Source                Destination           Protocol Length Info
